{
  "$schema": "../../../contracts/plugin-evaluation-1.0.schema.json",
  "schema_version": "1.0",
  "plugin": {
    "id": "contentcloud-video-production",
    "version": "0.18.0",
    "digest": "sha256:c029682f0125aab8690455a36644d318cd66982ca765f18a691b9fe0a90d2999"
  },
  "scope": "deterministic_release_contract",
  "status": "passed",
  "scenarios": [
    {
      "id": "codex-plugin-transaction",
      "requirement": "Pinned Marketplace and Plugin plans remain read-only until confirmation, validate after install, roll back only owned changes, and open a new Codex chat through the documented fallback.",
      "command": [
        "go",
        "test",
        "-v",
        "./internal/codexplugin",
        "-run",
        "^(TestPlanIsReadOnlyAndPinsMarketplaceAndPlugin|TestDetectClassifiesCurrentOutdatedAndBroken|TestDetectAcceptsMarketplaceListWithoutRefWhenCheckoutMatchesPinnedRef|TestPlanRepairsSameSourceMarketplaceRef|TestPlanBlocksPluginOnlyDriftThatCannotBeRolledBack|TestUpgradeFailureRestoresPreviousMarketplaceAndPlugin|TestApplyRequiresConfirmation|TestApplyInstallsAndValidates|TestApplyRollsBackOnlyMarketplaceAddedByThisRun|TestNewChatDeepLinkContainsWorkspaceAndPluginMention|TestLaunchNewChatFallsBackToWorkspaceCommand)$"
      ],
      "evidence": [
        "TestPlanIsReadOnlyAndPinsMarketplaceAndPlugin",
        "TestDetectAcceptsMarketplaceListWithoutRefWhenCheckoutMatchesPinnedRef",
        "TestPlanRepairsSameSourceMarketplaceRef",
        "TestPlanBlocksPluginOnlyDriftThatCannotBeRolledBack",
        "TestUpgradeFailureRestoresPreviousMarketplaceAndPlugin",
        "TestApplyRequiresConfirmation",
        "TestApplyInstallsAndValidates",
        "TestApplyRollsBackOnlyMarketplaceAddedByThisRun",
        "TestLaunchNewChatFallsBackToWorkspaceCommand"
      ],
      "status": "passed"
    },
    {
      "id": "bootstrap-confirmation",
      "requirement": "Bootstrap uses a deterministic plan_id, performs no mutation before exact confirmation, binds one browser authorization attempt to one session, runs doctor before registration, and preserves recoverability on failure.",
      "command": [
        "go",
        "test",
        "-v",
        "./internal/cli",
        "./internal/app",
        "-run",
        "^(TestBootstrapPlanIsReadOnlyAndUsesOnlyPublicSessionID|TestBootstrapPlanIDIsStableUntilInputsChange|TestBootstrapApplyInstallsInitializesDoctorsAndRegisters|TestBootstrapApplyUpgradesExistingPluginAndInitializesWorkspace|TestBootstrapResumeUpgradesExistingPluginWithoutReinitializingWorkspace|TestBootstrapApplyAuthorizationFailureDoesNotMutatePluginOrWorkspace|TestBootstrapApplyRejectsUnconfirmedPlanID|TestBootstrapApplyRequiresPlanIDBeforeMutation|TestBootstrapApplyRejectsPlanAfterCodexStateChanges|TestBootstrapAuthorizationRequiresApprovalAndMatchingVerifier|TestBootstrapAuthorizationAllowsOnlyOneActiveAttemptPerSession)$"
      ],
      "evidence": [
        "TestBootstrapPlanIsReadOnlyAndUsesOnlyPublicSessionID",
        "TestBootstrapApplyInstallsInitializesDoctorsAndRegisters",
        "TestBootstrapApplyUpgradesExistingPluginAndInitializesWorkspace",
        "TestBootstrapResumeUpgradesExistingPluginWithoutReinitializingWorkspace",
        "TestBootstrapApplyRejectsUnconfirmedPlanID",
        "TestBootstrapApplyRejectsPlanAfterCodexStateChanges",
        "TestBootstrapAuthorizationRequiresApprovalAndMatchingVerifier",
        "TestBootstrapAuthorizationAllowsOnlyOneActiveAttemptPerSession"
      ],
      "status": "passed"
    },
    {
      "id": "cross-conversation-handoff",
      "requirement": "New conversations recover persisted state, expose one business next step for an uninitialized project, and atomically transfer one exact Run revision without reading prior transcripts.",
      "command": [
        "go",
        "test",
        "-v",
        "./internal/localworkspace",
        "./internal/cli",
        "-run",
        "^(TestConversationContextReadsPersistedOfflineState|TestConversationContextExposesOneBusinessNextStep|TestRunClaimIsSingleWriterAndExpiredTakeoverIsExplicit|TestHandoffAcceptIsAtomicAcrossConversations|TestHandoffRejectsChangedInputDigest|TestMCPListsAndCallsWorkspaceTools|TestMCPRunsCrossConversationHandoffLifecycle)$"
      ],
      "evidence": [
        "TestConversationContextReadsPersistedOfflineState",
        "TestConversationContextExposesOneBusinessNextStep",
        "TestRunClaimIsSingleWriterAndExpiredTakeoverIsExplicit",
        "TestHandoffAcceptIsAtomicAcrossConversations",
        "TestHandoffRejectsChangedInputDigest",
        "TestMCPListsAndCallsWorkspaceTools",
        "TestMCPRunsCrossConversationHandoffLifecycle"
      ],
      "status": "passed"
    },
    {
      "id": "governed-publish",
      "requirement": "Publish binds exact files, disclosures, message, idempotency key, and environment to a confirmed plan_id and performs no cloud write for a missing, stale, or unconfirmed plan.",
      "command": [
        "go",
        "test",
        "-v",
        "./internal/cli",
        "-run",
        "^(TestPublishPlanIDIsStableAndBindsExactInputs|TestPublishCLIRejectsMissingOrStalePlanBeforeCloudWrite|TestMCPPublishApplyRequiresExactConfirmationBeforeCloudWrite|TestPublishReadersRejectSymlinksOutsideWorkspace)$"
      ],
      "evidence": [
        "TestPublishPlanIDIsStableAndBindsExactInputs",
        "TestPublishCLIRejectsMissingOrStalePlanBeforeCloudWrite",
        "TestMCPPublishApplyRequiresExactConfirmationBeforeCloudWrite",
        "TestPublishReadersRejectSymlinksOutsideWorkspace"
      ],
      "status": "passed"
    },
    {
      "id": "review-and-approved-resume",
      "requirement": "Review feedback and ApprovedSnapshots are explicitly pulled, stored immutably, verified, and reused by later credential-free conversations without cloud reads.",
      "command": [
        "go",
        "test",
        "-v",
        "./internal/localworkspace",
        "./internal/cli",
        "-run",
        "^(TestReviewFeedbackInboxKeepsImmutableRevisionsOfOneSubmissionRevision|TestReviewFeedbackInboxRejectsDigestMismatch|TestMCPFeedbackPullCreatesImmutableInboxForNewConversation|TestApprovedSnapshotCacheKeepsImmutableVersions|TestApprovedSnapshotCacheRejectsTamperingAndUnverifiedLegacyEntry|TestMCPApprovedSnapshotPullSupportsOfflineCrossConversationRead|TestWorkspaceApprovedCommandsReadCacheWithoutCredential)$"
      ],
      "evidence": [
        "TestReviewFeedbackInboxKeepsImmutableRevisionsOfOneSubmissionRevision",
        "TestMCPFeedbackPullCreatesImmutableInboxForNewConversation",
        "TestApprovedSnapshotCacheKeepsImmutableVersions",
        "TestApprovedSnapshotCacheRejectsTamperingAndUnverifiedLegacyEntry",
        "TestMCPApprovedSnapshotPullSupportsOfflineCrossConversationRead"
      ],
      "status": "passed"
    },
    {
      "id": "knowledge-contract",
      "requirement": "Knowledge candidates remain evidence-bound, reject invented or out-of-workspace inputs, and become eligible only through a verified ApprovedSnapshot.",
      "command": [
        "go",
        "test",
        "-v",
        "./internal/localworkspace",
        "-run",
        "^(TestKnowledgeCandidateFlowToApprovedQueryAndPack|TestKnowledgeImportRejectsInventedEvidence|TestKnowledgeImportRejectsSymlinkOutsideWorkspace|TestKnowledgeImportRejectsInvalidCandidatePackageShapes)$"
      ],
      "evidence": [
        "TestKnowledgeCandidateFlowToApprovedQueryAndPack",
        "TestKnowledgeImportRejectsInventedEvidence",
        "TestKnowledgeImportRejectsSymlinkOutsideWorkspace",
        "TestKnowledgeImportRejectsInvalidCandidatePackageShapes"
      ],
      "status": "passed"
    },
    {
      "id": "content-contract",
      "requirement": "ContentItem and ContentBatch contracts enforce explicit arrays, blocked reasons, approved references, and declared revision drift before publish or export.",
      "command": [
        "go",
        "test",
        "-v",
        "./internal/localworkspace",
        "./internal/cli",
        "-run",
        "^(TestContentItemRevisionDiffRejectsUndeclaredDrift|TestContentItemLintRequiresExplicitArraysAndBlockedReasons|TestPublishPreflightUsesContentBatchManifestAndAllowsBlockedItems|TestPublishPreflightRejectsBriefThatSkippedLocalLint)$"
      ],
      "evidence": [
        "TestContentItemRevisionDiffRejectsUndeclaredDrift",
        "TestContentItemLintRequiresExplicitArraysAndBlockedReasons",
        "TestPublishPreflightUsesContentBatchManifestAndAllowsBlockedItems",
        "TestPublishPreflightRejectsBriefThatSkippedLocalLint"
      ],
      "status": "passed"
    },
    {
      "id": "v5-local-production-boundary",
      "requirement": "Audience strategy, storyboard, and Seedance workflows keep candidates local, require governed ApprovedSnapshots for downstream work, and prevent Codex from fabricating server approval or external-platform side effects.",
      "command": [
        "go",
        "test",
        "-v",
        "./internal/localworkspace",
        "./internal/app",
        "./internal/cli",
        "./plugins/contentcloud-video-production/skills",
        "-run",
        "^(TestAudienceStrategyScaffoldRequiresPulledTaxonomyAndProducesCandidates|TestStoryboardApprovalBoundaryAndSeedanceExport|TestStoryboardShotIDsCannotEscapeTheirPackage|TestServerRejectsLocalV5CandidatesAsFormalSubmissions|TestServerRequiresApprovedTaxonomyBaselineForAudienceStrategy|TestServerValidatesStoryboardContentBaseline|TestStrategyPublishPreflightIncludesApprovedTaxonomyBaseline|TestV5SkillsDeclareExecutionBoundaries)$"
      ],
      "evidence": [
        "TestAudienceStrategyScaffoldRequiresPulledTaxonomyAndProducesCandidates",
        "TestStoryboardApprovalBoundaryAndSeedanceExport",
        "TestStoryboardShotIDsCannotEscapeTheirPackage",
        "TestServerRejectsLocalV5CandidatesAsFormalSubmissions",
        "TestServerRequiresApprovedTaxonomyBaselineForAudienceStrategy",